title,author,description,link,date,tags,publisher,imprint,image
Don’t Make Me Think (Revisited),Steve Krug,,http://amzn.to/2hm1FRV,2013,UX design,New Riders,Voices That Matter,/assets/dont-make-me-think.jpg
"The Design of Everyday Things, revised and expanded edition",Donald A. Norman,,http://amzn.to/2hhYn0x,2013,Usability,MIT Press,,/assets/design-of-everyday-things.jpg
About Face: The Essentials of Interaction Design,"Alan Cooper, Robert Reimann, David Cronin, Christopher Noessel",,http://amzn.to/2hB1CO8,2014,Interaction design,John Wiley & Sons,,/assets/about-face.jpg
100 Things Every Designer Needs to Know About People: What Makes Them Tick?,Susan Weinschenk,"We design to elicit responses from people. We want them to buy something, read more, or take action of some kind. Designing without understanding what makes people act the way they do is like exploring a new city without a map: results will be haphazard, confusing, and inefficient. This book combines real science and research with practical examples to deliver a guide every designer needs.",http://amzn.to/2hbKfTp,2011,UX design,New Riders,Voices That Matter,
Usable Usability: Simple Steps for Making Things Better,Eric Reiss,Frustrated by pop–ups? Forms that make you start over if you miss a field? Nonsensical error messages? You′re not alone! This book helps you simply get it right the first time (or fix what′s broken).,http://amzn.to/2i4AGtW,2012,"Usability, UX design",John Wiley & Sons,,
"Seductive Interaction Design: Creating Playful, Fun, and Effective User Experiences",Stephen P. Andserson,"What happens when you’ve built a great website or app, but no one seems to care? How do you get people to stick around long enough to see how your service might be of value? ",http://amzn.to/2i2koiQ,2011,"UX design, Interaction design",New Riders,Voices That Matter,
Lean UX: Applying Lean Principles to Improve User Experience,Jeff Gothelf,"The Lean UX approach to interaction design is tailor-made for today’s web-driven reality. In this insightful book, leading advocate Jeff Gothelf teaches you valuable Lean UX principles, tactics, and techniques from the ground up—how to rapidly experiment with design ideas, validate them with real users, and continually adjust your design based on what you learn.",http://amzn.to/2i2w1Gm,2013,UX design,O'Reilly Media,,
Sketching User Experiences: The Workbook,"Saul Greenberg, Sheelagh Carpendale, Nicolai Marquardt, Bill Buxton","Sketching Working Experience: The Workbook provides information about the step-by-step process of the different sketching techniques. It offers methods called design thinking, as a way to think as a user, and sketching, a way to think as a designer. ",http://amzn.to/2hBheRP,2011,UX design,Morgan Kaufmann,,
The User Experience Team of One: A Research and Design Survival Guide ,Leah Buley,"The User Experience Team of One prescribes a range of approaches that have big impact and take less time and fewer resources than the standard lineup of UX deliverables. Whether you want to cross over into user experience or you're a seasoned practitioner trying to drag your organization forward, this book gives you tools and insight for doing more with less.",http://amzn.to/2hmao6V,2013,UX design,Rosenfeld Media,,